<?xml version="1.0" encoding="UTF-8"?>
<Zahtev_za_priznanje_patenta xmlns="http://www.ftn.uns.ac.rs/p1"
    xmlns:xsi="http://www.w3.org/2001/XMLSchema-instance"
    xsi:schemaLocation="http://www.ftn.uns.ac.rs/p1 file:/C:/fakultet/7.%20semestar/XML/Projekat/XML-project/docs/xml-schema/P-1.xsd"
    broj_prijave="P3" datum_prijema_prijave="2022-09-24-06:00" priznati_datum_podnosenja="2022-09-25-06:00" tip_prijave="izdvojena">
    <Primalac_zahteva>
        <Adresa>
            <Drzava>Republika Srbija</Drzava>
            <Grad>Beograd</Grad>
            <Ulica>Kneginje Ljubice</Ulica>
            <Broj>12</Broj>
            <Postanski_broj>21000</Postanski_broj>
        </Adresa>
        <Naziv>Zavod za intelektualnu svojinu</Naziv>
    </Primalac_zahteva>
    <Pronalazak>
        <Naziv_na_srpskom>Patent1</Naziv_na_srpskom>
        <Naziv_na_engleskom>Patent1</Naziv_na_engleskom>
    </Pronalazak>
    <Pronalazac anoniman="false">
        <Adresa>
            <Drzava>Republika Srbija</Drzava>
            <Grad>Kikinda</Grad>
            <Ulica>Svetosavska</Ulica>
            <Broj>1</Broj>
            <Postanski_broj>23300</Postanski_broj>
        </Adresa>
        <Kontakt_podaci>
            <Telefon>0654332221</Telefon>
            <Faks>0230/111333</Faks>
            <Email>nl@gmail.com</Email>
        </Kontakt_podaci>
        <Ime>Natasa</Ime>
        <Prezime>Lakovic</Prezime>
        <Drzavljanstvo>Republika Srbija</Drzavljanstvo>
    </Pronalazac> 
    <Podnosilac_zahteva>
        <Lice xsi:type="TPravno_lice">
            <Adresa>
                <Drzava>Republika Srbija</Drzava>
                <Grad>Novi Sad</Grad>
                <Ulica>Radnicka</Ulica>
                <Broj>21</Broj>
                <Postanski_broj>21000</Postanski_broj>
            </Adresa>
            <Kontakt_podaci>
                <Telefon>067122290</Telefon>
                <Faks>021/201222</Faks>
                <Email>katarina@gmail.com</Email>
            </Kontakt_podaci>
            <Naziv>Ustanova1</Naziv>
        </Lice>
        <pronalazac>false</pronalazac>
    </Podnosilac_zahteva>
    <Punomocnik>
        <Lice xsi:type="TFizicko_lice">
            <Adresa>
                <Drzava>Republika Srbija</Drzava>
                <Grad>Novi Sad</Grad>
                <Ulica>Marije Bursać</Ulica>
                <Broj>1</Broj>
                <Postanski_broj>21000</Postanski_broj>
            </Adresa>
            <Kontakt_podaci>
                <Telefon>067899000</Telefon>
                <Faks>021/2022000</Faks>
                <Email>n@gmail.com</Email>
            </Kontakt_podaci>
            <Ime>Petar</Ime>
            <Prezime>Petrović</Prezime>
            <Drzavljanstvo>Republika Srbija</Drzavljanstvo>
        </Lice>
        <za_zastupanje>true</za_zastupanje>
        <za_prijem_pismena>false</za_prijem_pismena>
    </Punomocnik>
    <Podaci_o_dostavljanju>
        <Adresa>
            <Drzava>Republika Srbija</Drzava>
            <Grad>Novi Sad</Grad>
            <Ulica>Bulevar oslobodjenja</Ulica>
            <Broj>21</Broj>
            <Postanski_broj>21000</Postanski_broj>
        </Adresa>
        <Nacin_dostavljanja>elektronski</Nacin_dostavljanja>
    </Podaci_o_dostavljanju>
    <Zahtev_za_priznanje_prvenstva_iz_ranijih_prijava>
        <Ranija_prijava>
            <Datum_podnosenja>2022-09-24-06:00</Datum_podnosenja>
            <Broj_prijave>P2</Broj_prijave>
            <Dvoslovna_oznaka_drzave>RS</Dvoslovna_oznaka_drzave>
        </Ranija_prijava>
    </Zahtev_za_priznanje_prvenstva_iz_ranijih_prijava>
</Zahtev_za_priznanje_patenta>